spellName,"type","tier",categories,"reach","time","duration","effect"
Deterrence Bullet (SoS VI),Gun,III,"Mono, Gun, Ward, Repress, Physical (A)",1 target within 6 meters,Default,Instant,"Hit: STRd12 Gun damage. Warded: For the duration of the Warded condition on you, whenever a unit within 6 meters of you declares an attack, you can spend your Interrupt action to apply a -1 HDC to that attack, then you can Repress the use of any Physical spell in your deck: You can apply this effect once again this round against a different target."
Justice Shot (SoS VI),Gun,V,"Mono, Gun, Ward, Physical (A)",1 target within 5 meters,Default,Instant,"Hit: STRd12 Gun damage. Warded: If damage dealt by this spell reduces the target's HP to 50% or less, you can Repress and remove the Warded condition on yourself: This spell reduces the target's HP to 25%. This effect cannot be activated against targets with Hetelic Resistances."
Sinful Shell (SoS VI),Gun,V,"Mono, Gun, Heal, Physical (A)",1 target within 6 meters,Default,Instant,"Hit: STRd12+X*STR, where X is the number of Status, Buff, and Debuff effects active on you. After casting this spell, you can choose to remove any number of Status or Debuff effects on you as a Free action."
Plasma Smasher (SoS VI),Gun,V,"Mono, Gun, Curse, Physical (A)",1 target within 5 meters,Default,Instant,"Hit: STRd12+STR Gun damage. Warded: Apply the following Curse: Every time this unit takes Gun Type damage, add one Wildfire Counter to this target: When Warded is removed from the Caster, this target takes X/2 (Caster's) STR Gun damage, where X is the number of Wildfire Counters on this target, then remove all Wildfire Counters on this target. (This overrides the default Curse duration and triggering condition.)"
Prak (SoS VI),Bloom,I,"Mono, Line, Bloom, Pollen, Wind (A)",1 target between you and a point within 3 meters,Default,Instant,"On hit: MAGd6 Wind damage. After casting this spell, regardless of passing the hit check, move to the chosen point, for no additional action cost, and place Pollen on all spaces between you and this point."
Haprak (SoS VI),Bloom,I,"Multi, Line, Bloom, Pollen, Wind (A)",Up to 3 targets between you and a point within 3 meters,Default,Instant,"On hit: MAGd4 Wind damage. After casting this spell, place Pollen on the position of each target that took damage from this spell, then move to the chosen point, for no additional action cost."
Maprak (SoS VI),Bloom,I,"Movement, Bloom, Pollen, Wind (A)",Any number of targets you become adjacent to during your movement,Default,Instant,"As part of casting this spell, you spend your entire remaining movement allowance for this turn. On hit: MAGd4-4 Wind damage. Place Pollen on the position of each target that took damage from this spell."
Path of Yellow Carnations (SoS VI),Bloom,I,"Blossom, Wind (A)",Any number of targets in Pollen spaces,Default,Until the end of unit's next turn,"Until the end of each affected unit's turn, they take Wind damage equal to their SKL for each space they move as their movement action."
Trail of Dahlias (SoS VI),Bloom,I,"Blossom, Heal, Movement, Wind (A)",Any number of targets in Pollen spaces,Default,Instant,"Affected units recover HP equal to the caster's MAG and gain +2 Movement Allowance for the next movement action they declare. This does not stack with other activations of Trail of Dahlias."
Praka (SoS VI),Bloom,II,"Mono, Line, Bloom, Pollen, Wind (A)",1 target between you and a point within 4 meters,Default,Instant,"On hit: MAGd8 Wind damage. After casting this spell, regardless of passing the hit check, move to the chosen point, for no additional action cost, and place Pollen on all spaces between you and this point."
Hapraka (SoS VI),Bloom,II,"Multi, Line, Bloom, Pollen, Wind (A)",Up to 3 targets between you and a point within 3 meters,Default,Instant,"On hit: MAGd6 Wind damage. After casting this spell, place Pollen on the position of each target that took damage from this spell, then move to the chosen point, for no additional action cost."
Mapraka (SoS VI),Bloom,II,"Movement, Bloom, Pollen, Wind (A)",Any number of targets you become adjacent to during your movement,Default,Instant,"As part of casting this spell, you spend your entire remaining movement allowance for this turn. On hit: MAGd4 Wind damage. Place Pollen on your position, and on the position of each target that took damage from this spell."
Shrine of the Heliotrope (SoS VI),Bloom,II,"Quick, Pollen, Wind (A)",Any number of Pollen you placed,Quick,Instant,"Move all Pollen you placed to positions adjacent to you or one target within 4 meters."
"Lose thy Way, Geranium (SoS VI)",Bloom,II,"Blossom, Wind (A)",Any number of units on or adjacent to Pollen spaces,Default,Instant,"Affected units take MAGd2 Wind damage, no dodge check. This can damage each unit up to two times, if the effect of a Pollen space and another Pollen's adjacent spaces overlap."
Petals for Armor (SoS VI),Bloom,II,"Blossom, Damage (A)",Caster,Default,Until the start of your turn,"If you cast this spell while on a Pollen space, gain the following effect: Until the start of your next turn, if you take damage from a Type you Resist, Null, Drain, or Absorb, you can cast a Tier II or lower Pollen Category spell from your deck as your Interrupt action for that round. If casting a spell this way would spend Energy, it spends 1 less Energy."
Prakadyne (SoS VI),Bloom,III,"Mono, Line, Bloom, Pollen, Wind (A)",1 target between you and a point within 4 meters,Default,Instant,"On hit: MAGd10 Wind damage. After casting this spell, regardless of passing the hit check, move to the chosen point, for no additional action cost, and place Pollen on all spaces between you and this point, then place Pollen on your current position."
Haprakadyne (SoS VI),Bloom,III,"Movement, Bloom, Pollen, Wind (A)",Any number of targets you become adjacent to during your movement,Default,Instant,"As part of casting this spell, you spend your entire remaining movement allowance for this turn. Hit: MAGd6+5 Wind damage. Place Pollen on your final position, and on the position of each target that took damage from this spell."
Maprakadyne (SoS VI),Bloom,III,"Movement, Bloom, Pollen, Wind (A)",Any number of targets you become adjacent to during your movement,Default,Instant,"As part of casting this spell, you spend your entire remaining movement allowance for this turn. Hit: MAGd4 Wind damage. Place Pollen on your starting position, on the position of each target that took damage from this spell, and the final position after you cast this spell."
"In Mourning, Purple Hyacinth (SoS VI)",Bloom,III,"Blossom, Wind (A)",Any number of unoccupied Pollen spaces,Default,Until the start of your next turn,"Pollen spaces that were unoccupied when you cast this spell cannot be moved into or through until the start of your next turn."
Under the Gaze of the Amaryllis (SoS VI),Bloom,III,"Blossom, Damage (A)",Up to three targets on or adjacent to Pollen spaces,Default,Until the end of each target's next turn,"Affected units gain the following effect: When you deal damage with a basic attack, or a spell without the Pollen Category, you deal +SKL Wind damage, and can spend 1 Energy to place Pollen on the spaces of up to two targets who took damage from that attack or spell."
"To Our Home, in Marigold (SoS VI)",Bloom,V,"Mono, Line, Bloom, Pollen, Mind (A)",One target between you and a point within 4 meters,Default,Instant,"Hit: MAGd12+4 Wind damage and place Pollen on the target's space. After casting this spell, regardless of passing the hit check, move to the chosen point, for no additional action cost, place Pollen on all spaces between you and this point, then place Pollen on your current position."
Triumverate of the Hydrangea (SoS VI),Bloom,V,"Movement, Bloom, Pollen, Wind (A)",Any number of targets you can become adjacent to during your movement,Default,Instant,"As part of casting this spell, you spend your entire remaining movement allowance for this turn. Hit: MAGd8+MAG Wind damage. Place Pollen on your position, then place Pollen in one position for each target who took damage from this spell."
"Thyme, and Fate's Cruelty (SoS VI)",Bloom,V,"Movement, Bloom, Pollen, Wind (A)",Any number of targets you can become adjacent to during your movement,Default,Instant,"As part of casting this spell, you spend your entire remaining movement allowance for this turn. Hit: MAGd6 Wind damage. For every 4 spaces moved while casting this spell, place 1 Pollen onto any space within 5 meters."
Disappear Under a Sea of Crimson Roses (SoS VI),Bloom,V,"Quick, Movement, Death, Wind (A)",Any number of units on Pollen spaces,Quick,Instant,"Targets whose HP are below 20% are instantly slain. This is considered a Wind Type Death Effect. For each unit slain by this effect, you gain +1 Movement Allowance until the end of your turn. Against targets with Hetelic Resistances, this instead deals 5% of the target’s HP as Wind damage, and rolls to hit."
"March Forth, Edelweiss (SoS VI)",Bloom,V,"Blossom, Damage, Wind (A)",Any number of units on Pollen spaces,Default,Until the start of your next turn,"Choose a Type your Active Persona has. Affected units gain the following effect: The next time you take damage from a spell of the chosen Type, increase your Interaction with that Type by one step for that spell."
Vata (SoS VI),Weather,I,"Mono, Weather, Thunder (A)",1 target within 7 meters,Default,Instant,"On hit: MAGd6 Thunder damage and gain 1 Forecast counter."
Havata (SoS VI),Weather,I,"Multi, Weather, Thunder (A)",Up to 3 targets within 7 meters,Default,Instant,"On hit: MAGd4 Thunder damage and gain 1 Forecast counter. If this spell deals damage to at least one target who’s Weak against Thunder, you gain 1 more Forecast counter."
Mavata (SoS VI),Weather,I,"Total, Weather, Thunder (A)",Any number of targets within 7 meters,Default,Instant,"On hit: MAGd4-4 Thunder damage and gain 1 Forecast counter. If your HP is at 100% after you cast this spell, gain 1 more Forecast counter."
Gathering Clouds (SoS VI),Weather,I,"Weather, Quick (A)",Caster,Quick,Until the end of combat,"Spend 3 Forecast counters to apply Weather (Quick): Restore HP equal to your PLv. to yourself."
Strata (SoS VI),Weather,I,"Weather, Quick (A)",Caster,Quick,Instant,"Spend one use of another spell in your deck: Gain 1 Forecast counter."
Vatava (SoS VI),Weather,II,"Mono, Weather, Thunder (A)",1 target within 7 meters,Default,Instant,"On hit: MAGd8 Thunder damage and gain 1 Forecast counter. Critical: Gain 1 more Forecast counter."
Havatava (SoS VI),Weather,II,"Multi, Weather, Thunder (A)",Up to 3 targets within 7 meters,Default,Instant,"On hit: MAGd4+5 Thunder damage and gain 1 Forecast counter. If this spell dealt damage to all chosen targets, you gain 1 more Forecast counter."
Mavatava (SoS VI),Weather,II,"Total, Weather, Thunder (A)",Any number of targets within 7 meters,Default,Instant,"On hit: MAGd4 Thunder damage and gain 1 Forecast counter. If you are not suffering from Status or Debuff effects, you gain 1 more Forecast counter."
Dust Storm (SoS VI),Weather,II,"Weather, Quick (A)",Caster,Quick,Until the end of combat,"Spend 2 Forecast counters. Apply Weather (Default): Gain +1 DDC against the next attack declared against you."
Drought (SoS VI),Weather,II,"Weather (A)",Caster,Default,Until the end of combat,"Spend 2 Forecast counters. Apply Weather (Interrupt): When a Shadow rolls to resist or recover from a Status effect, you can trigger this Weather to force the Shadow to fail that check."
Vatadyne (SoS VI),Weather,III,"Mono, Weather, Thunder (A)",1 target within 7 meters,Default,Instant,"On hit: MAGd10 Thunder damage and gain 1 Forecast counter. If this spell slays its target, gain 1 more Forecast counter."
Havatadyne (SoS VI),Weather,III,"Multi, Weather, Thunder (A)",Up to 3 targets within 7 meters,Default,Instant,"On hit: MAGd6+MAG Thunder damage and gain 1 Forecast counter. If a Weather effect is already active, gain 1 more Forecast counter."
Mavatadyne (SoS VI),Weather,III,"Total, Weather, Thunder (A)",Any number of targets within 7 meters,Default,Instant,"On hit: MAGd4+6 Thunder damage and gain 1 Forecast counter. If you’re the first unit in the initiative queue, gain 1 more Forecast counter."
Undertow (SoS VI),Weather,III,"Weather, Quick (A)",Caster,Quick,Until the end of combat,"Spend 2 Forecast counters. Apply Weather (Interrupt): When a Shadow declares a movement action, you can trigger this Weather to gain extra Movement Allowance equal to half that Shadow’s moved distance, rounded up, for the next movement action you declare."
Blizzard (SoS VI),Weather,III,"Weather (A)",Caster,Default,Until the end of combat,"Spend 3 Forecast counters. This spell sets up a Weather condition with MAG + PLv. HP. Up to two times per turn, when you cast a Weather Category spell after this Weather is set up, you can spend 1 Energy to restore MAG HP to this Weather as a Free action. Weather (Interrupt): When you take damage, you can trigger this Weather to subtract any amount of damage from this spell’s HP pool instead, up to its current HP. If this Weather reaches 0 HP, remove the Weather condition from combat."
Squall Line (SoS VI),Weather,V,"Mono, Weather, Thunder (A)",1 target within 7 meters,Default,Instant,"On hit: MAGd12 Thunder damage and gain 1 Forecast counter. You can spend one Energy to apply the effect of Rakundamon to the target (Fortify Physical & Elements -8 for 3 rounds) after damage calculation."
Devouring Sea Fret (SoS VI),Weather,V,"Multi, Weather, Thunder (A)",Up to 3 targets within 7 meters,Default,Instant,"On hit: MAGd10 + MAG Thunder damage, gain 1 Forecast counter and +1 HDC for the next damage-dealing Weather Category spell you cast (this is not a Buff effect)."
Pulse Storm (SoS VI),Weather,V,"Total, Weather, Thunder (A)",Any number of targets within 7 meters,Default,Instant,"On hit: MAGd10 Thunder damage and gain 1 Forecast counter. If you cast Pulse Storm in your previous turn, gain 1 extra Forecast counter."
Supercell (SoS VI),Weather,V,"Weather, Quick (A)",Caster,Quick,Until the end of combat,"Spend 4 Forecast counters. If there’s already a Tier III or lower Weather in effect, applying this Weather does not remove it. Apply Weather (Quick): Triggering this Weather costs 1 Energy. The next basic attack or Mono Category spell you declare this round deals SKL extra Thunder damage. This damage applies even if the attack misses. This is not a Buff effect."
Heat Lightning (SoS VI),Weather,V,"Weather (A)",Caster,Default,Until the end of combat,"You do not spend Forecast counters to cast this spell, and Weather applied by this spell cannot be activated by the same User in two consecutive turns. Apply Weather (Quick): Triggering this Weather costs 1 Energy: Reduce the duration of all Debuff effects on you by 1 round, or extend the effect of a Buff effect active on you by 1 round."
